"BBMKG","kab"
"Balai Besar MKG Wilayah I","Aceh: Aceh Selatan, Aceh Tamiang, Aceh Timur, Kota Langsa; Kepulauan Riau: Bintan, Karimun, Kota Batam, Kota Tanjung Pinang, Lingga, Natuna; Riau: Bengkalis, Indragiri Hilir, Indragiri Hulu, Kampar, Kepulauan Meranti, Kota Dumai, Kota Pekanbaru, Kuantan Singingi, Pelalawan, Rokan Hilir, Siak; Sumatera Barat: Agam, Dharmasraya, Kota Padang, Kota Padang Panjang, Kota Payakumbuh, Kota Sawahlunto, Kota Solok, Lima Puluh Kota, Pasaman, Pasaman Barat, Pesisir Selatan, Sijunjung, Solok, Solok Selatan, Tanah Datar; Sumatera Utara: Asahan, Batu Bara, Dairi, Deli Serdang, Humbang Hasundutan, Karo, Kota Medan, Kota Padang Sidempuan, Kota Tanjung Balai, Labuhanbatu, Labuhanbatu Selatan, Labuhanbatu Utara, Langkat, Mandailing Natal, Padang Lawas, Padang Lawas Utara, Samosir, Serdang Bedagai, Simalungun, Tapanuli Selatan, Tapanuli Utara, Toba Samosir"
"Balai Besar MKG Wilayah II","Bangka Belitung: Bangka, Bangka Barat, Bangka Selatan, Bangka Tengah, Belitung, Belitung Timur; Bengkulu: Bengkulu Selatan, Bengkulu Tengah, Bengkulu Utara, Kaur, Kepahiang, Lebong, Muko Muko, Rejang Lebong, Seluma; Jambi: Batanghari, Bungo, Kerinci, Kota Jambi, Kota Sungai Penuh, Merangin, Muaro Jambi, Sarolangun, Tanjung Jabung Barat, Tanjung Jabung Timur, Tebo; Kalimantan Barat: Bengkayang, Kayong Utara, Ketapang, Kota Pontianak, Kota Singkawang, Kubu Raya, Landak, Mempawah, Sambas; Lampung: Lampung Barat, Lampung Tengah, Lampung Utara, Pesisir Barat, Pringsewu, Tanggamus; Sumatera Selatan: Banyuasin, Empat Lawang, Kota Lubuk Linggau, Kota Pagar Alam, Lahat, Muara Enim, Musi Banyuasin, Musi Rawas, Musi Rawas Utara, Ogan Komering Ulu, Ogan Komering Ulu Selatan"
"Balai Besar MKG Wilayah IV","Gorontalo: Boalemo, Bone Bolango, Gorontalo, Kota Gorontalo, Pahuwato; Maluku: Buru Selatan, Kota Ambon, Maluku Tengah, Seram Bagian Barat; Maluku Utara: Pulau Taliabu; Sulawesi Barat: Majene, Mamasa, Mamuju, Mamuju Tengah, Pasangkayu, Polewali Mandar; Sulawesi Selatan: Bantaeng, Bone, Bulukumba, Enrekang, Kepulauan Selayar, Kota Palopo, Luwu, Luwu Utara, Pinrang, Sidenreng Rappang, Sinjai, Soppeng, Tana Toraja, Wajo; Sulawesi Tengah: Banggai, Banggai Kepulauan, Banggai Laut, Donggala, Kota Palu, Morowali Utara, Parigi Moutong, Poso, Sigi, Tojo Una Una, Toli Toli; Sulawesi Tenggara: Bombana, Kolaka, Kolaka Timur, Kolaka Utara; Sulawesi Utara: Bolaang Mongondow Timur"
"Balai Besar MKG Wilayah III","Jawa Timur: Sumenep; Kalimantan Selatan: Kotabaru, Tanah Bumbu, Tanah Laut; Kalimantan Tengah: Kotawaringin Barat, Lamandau, Sukamara; Kalimantan Timur: Kutai Kartanegara"
"Balai Besar MKG Wilayah V","Papua: Asmat, Mimika"
